{
  "case_id": "pf-fhir-agent-0020",
  "capability_id": "FG-01",
  "output_contract": "fhir_resource",
  "expected": {
    "assertions": [
      {"path": "resourceType", "equals": "Observation"},
      {"path": "status", "equals": "final"},
      {"path": "code.coding[*].system", "equals": "http://loinc.org"},
      {"path": "code.coding[*].code", "equals": "4548-4"},
      {"path": "subject.reference", "equals": "Patient/pat-001"},
      {"path": "encounter.reference", "equals": "Encounter/enc-001"},
      {"path": "effectiveDateTime", "equals": "2026-05-20"},
      {"path": "valueQuantity.value", "equals": 7.2},
      {"path": "valueQuantity.code", "equals": "%"}
    ],
    "evidence": ["Patient/pat-001", "Encounter/enc-001"],
    "reference_resource": {
      "resourceType": "Observation",
      "id": "obs-hba1c",
      "status": "final",
      "category": [{"coding": [{"system": "http://terminology.hl7.org/CodeSystem/observation-category", "code": "laboratory"}]}],
      "code": {"coding": [{"system": "http://loinc.org", "code": "4548-4", "display": "Hemoglobin A1c/Hemoglobin.total in Blood"}], "text": "HbA1c"},
      "subject": {"reference": "Patient/pat-001"},
      "encounter": {"reference": "Encounter/enc-001"},
      "effectiveDateTime": "2026-05-20",
      "valueQuantity": {"value": 7.2, "unit": "%", "system": "http://unitsofmeasure.org", "code": "%"}
    }
  },
  "safety_events": [],
  "notes": "FG-01: generate a valid HbA1c Observation. FV scores structural validity; CC scores the path assertions (right LOINC code, value, subject/encounter refs, units)."
}
