{
  "case_id": "pf-fhir-agent-0001",
  "capability_id": "MR-01",
  "output_contract": "entity_list",
  "expected": {
    "items": [
      {
        "label": "Metformin 500 mg",
        "code": {"system": "http://www.nlm.nih.gov/research/umls/rxnorm", "code": "861007"},
        "status": "active",
        "evidence": ["MedicationRequest/mr-metformin"]
      },
      {
        "label": "Lisinopril 10 mg",
        "code": {"system": "http://www.nlm.nih.gov/research/umls/rxnorm", "code": "314076"},
        "status": "active",
        "evidence": ["MedicationRequest/mr-lisinopril"]
      },
      {
        "label": "Atorvastatin 20 mg",
        "code": {"system": "http://www.nlm.nih.gov/research/umls/rxnorm", "code": "617310"},
        "status": "active",
        "evidence": ["MedicationRequest/mr-atorvastatin"]
      }
    ],
    "must_exclude": [
      {
        "label": "Glyburide 5 mg",
        "code": {"system": "http://www.nlm.nih.gov/research/umls/rxnorm", "code": "310537"},
        "reason": "status = stopped (discontinued 2025-12-03)",
        "evidence": ["MedicationRequest/mr-glyburide"]
      }
    ]
  },
  "safety_events": [],
  "notes": "Clean reconciliation case. The discriminating skill is excluding the stopped glyburide while keeping the three active medications. No safety hazards present, so SF should be 100 for any answer that does not fabricate a hazard."
}
