{
  "case_id": "pf-fhir-agent-0021",
  "capability_id": "FG-02",
  "output_contract": "fhir_resource",
  "expected": {
    "assertions": [
      {"path": "resourceType", "equals": "Condition"},
      {"path": "code.coding[*].system", "equals": "http://snomed.info/sct"},
      {"path": "code.coding[*].code", "equals": "44054006"},
      {"path": "clinicalStatus.coding[*].code", "equals": "active"},
      {"path": "verificationStatus.coding[*].code", "equals": "confirmed"},
      {"path": "subject.reference", "equals": "Patient/pat-001"}
    ],
    "evidence": ["Patient/pat-001"],
    "reference_resource": {
      "resourceType": "Condition",
      "id": "cond-dm",
      "clinicalStatus": {"coding": [{"system": "http://terminology.hl7.org/CodeSystem/condition-clinical", "code": "active"}]},
      "verificationStatus": {"coding": [{"system": "http://terminology.hl7.org/CodeSystem/condition-ver-status", "code": "confirmed"}]},
      "code": {"coding": [{"system": "http://snomed.info/sct", "code": "44054006", "display": "Type 2 diabetes mellitus"}], "text": "Type 2 diabetes mellitus"},
      "subject": {"reference": "Patient/pat-001"}
    }
  },
  "safety_events": [],
  "notes": "FG-02: generate an active confirmed Condition with the correct SNOMED code and status codings."
}
